{
  "loginChain": [
    {
      "id": "login-1",
      "method": "POST",
      "url": "https://10.0.0.10/api/session",
      "status": 200,
      "contentType": "application/json",
      "redirectHop": 0,
      "redirectedFromId": "",
      "redirectedToId": "",
      "tags": [
        "login"
      ],
      "windowRole": "main",
      "captureWindowId": "win-main",
      "requestJsonKeys": [],
      "responseJsonKeys": [],
      "redactedFields": [
        "Password",
        "CSRFToken"
      ],
      "requestBodySample": null,
      "responseBodySample": null,
      "responseStructure": {
        "bodyKind": "json-object",
        "jsonKeys": [
          "CSRFToken"
        ],
        "jsonShape": {
          "CSRFToken": "string"
        },
        "jsonPaths": {
          "$.CSRFToken": "string"
        }
      }
    }
  ],
  "kvmLaunchChain": [
    {
      "id": "token-1",
      "method": "GET",
      "url": "https://10.0.0.10/api/kvm/token",
      "status": 200,
      "contentType": "application/json",
      "redirectHop": 0,
      "redirectedFromId": "",
      "redirectedToId": "",
      "tags": [
        "kvm-token"
      ],
      "windowRole": "main",
      "captureWindowId": "win-main",
      "requestBodySample": null,
      "responseBodySample": null,
      "responseStructure": {
        "bodyKind": "json-object",
        "jsonKeys": [
          "token"
        ],
        "jsonShape": {
          "token": "string"
        },
        "jsonPaths": {
          "$.token": "string"
        }
      }
    }
  ],
  "webSocketUpgrades": [
    {
      "id": "ws-1",
      "url": "wss://10.0.0.10/kvm",
      "subProtocols": [
        "binary"
      ],
      "requestHeaderNames": [],
      "handshakeStatus": 101,
      "responseHeaderNames": [
        "sec-websocket-protocol"
      ],
      "responseSubProtocol": "binary",
      "binaryFrameCount": 12,
      "textFrameCount": 0,
      "sampledFrameCount": 1,
      "droppedFrameCount": 11,
      "tags": [
        "kvm-video"
      ],
      "windowRole": "main",
      "captureWindowId": "win-main",
      "firstFrame": {
        "direction": "down",
        "opcode": "binary",
        "bytes": 64,
        "headHex": "17000001",
        "magic": ""
      }
    }
  ],
  "correlations": [
    {
      "socketId": "ws-1",
      "captureWindowId": "win-main",
      "windowRole": "main",
      "likelyLoginHttpIds": [
        "login-1"
      ],
      "likelyKvmLaunchHttpIds": [
        "token-1"
      ]
    }
  ]
}